{
  "schema_version": 1,
  "layout": {
    "w": 640,
    "h": 480
  },
  "nodes": [
    {
      "id": "circ-centripetal-accel",
      "label": "a_c",
      "name": "Centripetal acceleration",
      "domain": "mechanics",
      "degree": 2,
      "x": 286.28,
      "y": 40
    },
    {
      "id": "circ-centripetal-force",
      "label": "F_c",
      "name": "Centripetal force",
      "domain": "mechanics",
      "degree": 2,
      "x": 86.65,
      "y": 40
    },
    {
      "id": "damped-omega-d",
      "label": "\\omega_d",
      "name": "Damped angular frequency",
      "domain": "mechanics",
      "degree": 2,
      "x": 600,
      "y": 303.56
    },
    {
      "id": "damped-zeta",
      "label": "\\zeta",
      "name": "Damping ratio",
      "domain": "mechanics",
      "degree": 1,
      "x": 600,
      "y": 149.83
    },
    {
      "id": "drag-terminal",
      "label": "v_{\\text{term}}",
      "name": "Terminal velocity (linear drag)",
      "domain": "mechanics",
      "degree": 1,
      "x": 600,
      "y": 440
    },
    {
      "id": "drag-v-of-t",
      "label": "v",
      "name": "Velocity under linear drag",
      "domain": "mechanics",
      "degree": 4,
      "x": 600,
      "y": 440
    },
    {
      "id": "dyn-friction-kinetic",
      "label": "f_k",
      "name": "Kinetic friction",
      "domain": "mechanics",
      "degree": 0,
      "x": 40,
      "y": 440
    },
    {
      "id": "dyn-hookes-law",
      "label": "F",
      "name": "Hooke's law (spring force)",
      "domain": "mechanics",
      "degree": 2,
      "x": 570.53,
      "y": 440
    },
    {
      "id": "dyn-newton-2",
      "label": "F_{\\text{net}}",
      "name": "Newton's second law",
      "domain": "mechanics",
      "degree": 3,
      "x": 207.13,
      "y": 40
    },
    {
      "id": "dyn-weight",
      "label": "F_g",
      "name": "Weight (gravitational force near Earth)",
      "domain": "mechanics",
      "degree": 4,
      "x": 414.58,
      "y": 40
    },
    {
      "id": "em-bfield-wire",
      "label": "B",
      "name": "Magnetic field of a long straight wire",
      "domain": "em",
      "degree": 4,
      "x": 64.54,
      "y": 440
    },
    {
      "id": "em-capacitance",
      "label": "C",
      "name": "Capacitance",
      "domain": "em",
      "degree": 4,
      "x": 600,
      "y": 440
    },
    {
      "id": "em-capacitor-energy",
      "label": "U",
      "name": "Energy stored in a capacitor",
      "domain": "em",
      "degree": 3,
      "x": 600,
      "y": 440
    },
    {
      "id": "em-coulomb",
      "label": "F",
      "name": "Coulomb's law",
      "domain": "em",
      "degree": 3,
      "x": 371.67,
      "y": 209.15
    },
    {
      "id": "em-efield-point",
      "label": "E",
      "name": "Electric field of a point charge",
      "domain": "em",
      "degree": 2,
      "x": 309.43,
      "y": 133.55
    },
    {
      "id": "em-flux",
      "label": "\\Phi",
      "name": "Magnetic flux",
      "domain": "em",
      "degree": 4,
      "x": 180.64,
      "y": 440
    },
    {
      "id": "em-lorentz-force",
      "label": "F",
      "name": "Magnetic force on a charge",
      "domain": "em",
      "degree": 4,
      "x": 40,
      "y": 380.29
    },
    {
      "id": "em-motional-emf",
      "label": "\\mathcal{E}",
      "name": "Motional EMF",
      "domain": "em",
      "degree": 3,
      "x": 347.74,
      "y": 440
    },
    {
      "id": "em-ohms-law",
      "label": "V",
      "name": "Ohm's law",
      "domain": "em",
      "degree": 2,
      "x": 40,
      "y": 440
    },
    {
      "id": "em-potential-energy",
      "label": "U",
      "name": "Electric potential energy of two charges",
      "domain": "em",
      "degree": 3,
      "x": 221.57,
      "y": 152.19
    },
    {
      "id": "em-potential-point",
      "label": "V",
      "name": "Electric potential of a point charge",
      "domain": "em",
      "degree": 3,
      "x": 249.83,
      "y": 40
    },
    {
      "id": "em-power-electric",
      "label": "P",
      "name": "Electrical power",
      "domain": "em",
      "degree": 3,
      "x": 40,
      "y": 361.48
    },
    {
      "id": "em-rc-time-constant",
      "label": "\\tau",
      "name": "RC time constant",
      "domain": "em",
      "degree": 3,
      "x": 600,
      "y": 440
    },
    {
      "id": "em-wire-force",
      "label": "F",
      "name": "Magnetic force on a current-carrying wire",
      "domain": "em",
      "degree": 2,
      "x": 40,
      "y": 210.54
    },
    {
      "id": "en-kinetic",
      "label": "K",
      "name": "Kinetic energy",
      "domain": "mechanics",
      "degree": 6,
      "x": 467.07,
      "y": 94.53
    },
    {
      "id": "en-mech-energy",
      "label": "E",
      "name": "Mechanical energy (kinetic + gravitational potential)",
      "domain": "mechanics",
      "degree": 3,
      "x": 554.76,
      "y": 71.27
    },
    {
      "id": "en-power",
      "label": "P",
      "name": "Mechanical power (constant force)",
      "domain": "mechanics",
      "degree": 2,
      "x": 74.71,
      "y": 186.68
    },
    {
      "id": "en-spring-pe",
      "label": "U_s",
      "name": "Elastic potential energy",
      "domain": "mechanics",
      "degree": 3,
      "x": 600,
      "y": 440
    },
    {
      "id": "en-work",
      "label": "W",
      "name": "Work (constant force along displacement)",
      "domain": "mechanics",
      "degree": 7,
      "x": 348.46,
      "y": 40
    },
    {
      "id": "fluid-bernoulli",
      "label": "P_0",
      "name": "Bernoulli's equation (total pressure)",
      "domain": "mechanics",
      "degree": 4,
      "x": 600,
      "y": 40
    },
    {
      "id": "fluid-buoyancy",
      "label": "F_b",
      "name": "Buoyant force (Archimedes' principle)",
      "domain": "mechanics",
      "degree": 3,
      "x": 579.64,
      "y": 40
    },
    {
      "id": "fluid-continuity",
      "label": "Q",
      "name": "Continuity (volume flow rate)",
      "domain": "mechanics",
      "degree": 2,
      "x": 600,
      "y": 40
    },
    {
      "id": "fluid-force-wall",
      "label": "F",
      "name": "Hydrostatic force on a vertical wall",
      "domain": "mechanics",
      "degree": 2,
      "x": 356.06,
      "y": 40
    },
    {
      "id": "fluid-hydrostatic-pressure",
      "label": "P",
      "name": "Hydrostatic pressure with depth",
      "domain": "mechanics",
      "degree": 4,
      "x": 532.49,
      "y": 40
    },
    {
      "id": "grav-newton",
      "label": "F",
      "name": "Newton's law of universal gravitation",
      "domain": "mechanics",
      "degree": 5,
      "x": 463.85,
      "y": 40
    },
    {
      "id": "kin-a-const",
      "label": "a",
      "name": "Constant acceleration",
      "domain": "mechanics",
      "degree": 2,
      "x": 307.31,
      "y": 440
    },
    {
      "id": "kin-v-of-t",
      "label": "v",
      "name": "Velocity under constant acceleration",
      "domain": "mechanics",
      "degree": 5,
      "x": 445.6,
      "y": 440
    },
    {
      "id": "kin-x-of-t",
      "label": "x",
      "name": "Position under constant acceleration",
      "domain": "mechanics",
      "degree": 2,
      "x": 489.73,
      "y": 440
    },
    {
      "id": "modern-de-broglie",
      "label": "\\lambda",
      "name": "de Broglie wavelength",
      "domain": "modern",
      "degree": 3,
      "x": 40,
      "y": 73.84
    },
    {
      "id": "modern-mass-energy",
      "label": "E",
      "name": "Mass–energy equivalence",
      "domain": "modern",
      "degree": 1,
      "x": 139.23,
      "y": 40
    },
    {
      "id": "modern-photoelectric",
      "label": "K_{\\max}",
      "name": "Photoelectric effect",
      "domain": "modern",
      "degree": 1,
      "x": 40,
      "y": 40
    },
    {
      "id": "modern-photon-energy",
      "label": "E",
      "name": "Photon energy",
      "domain": "modern",
      "degree": 5,
      "x": 40,
      "y": 76.17
    },
    {
      "id": "mom-impulse",
      "label": "J",
      "name": "Impulse (constant force)",
      "domain": "mechanics",
      "degree": 2,
      "x": 40,
      "y": 40
    },
    {
      "id": "mom-inelastic-v",
      "label": "v_f",
      "name": "Perfectly inelastic collision (common velocity)",
      "domain": "mechanics",
      "degree": 2,
      "x": 40,
      "y": 40
    },
    {
      "id": "mom-momentum",
      "label": "p",
      "name": "Linear momentum",
      "domain": "mechanics",
      "degree": 5,
      "x": 40,
      "y": 40
    },
    {
      "id": "optics-magnification",
      "label": "m",
      "name": "Magnification (thin lens or mirror)",
      "domain": "waves-optics",
      "degree": 2,
      "x": 40,
      "y": 440
    },
    {
      "id": "optics-snell",
      "label": "\\theta_2",
      "name": "Snell's law of refraction",
      "domain": "waves-optics",
      "degree": 2,
      "x": 40,
      "y": 440
    },
    {
      "id": "optics-thin-lens",
      "label": "\\frac{1}{f}",
      "name": "Thin-lens equation",
      "domain": "waves-optics",
      "degree": 3,
      "x": 40,
      "y": 440
    },
    {
      "id": "orbit-kepler-third",
      "label": "T",
      "name": "Kepler's third law (circular orbit)",
      "domain": "mechanics",
      "degree": 3,
      "x": 600,
      "y": 40
    },
    {
      "id": "orbit-velocity",
      "label": "v",
      "name": "Circular orbital speed",
      "domain": "mechanics",
      "degree": 4,
      "x": 553.97,
      "y": 40
    },
    {
      "id": "rot-angular-momentum",
      "label": "L",
      "name": "Angular momentum (rigid body)",
      "domain": "mechanics",
      "degree": 1,
      "x": 40,
      "y": 40
    },
    {
      "id": "rot-kinetic",
      "label": "K_{\\text{rot}}",
      "name": "Rotational kinetic energy",
      "domain": "mechanics",
      "degree": 4,
      "x": 579.35,
      "y": 40
    },
    {
      "id": "rot-moment-disk",
      "label": "I",